都道府県コード又は市区町村コード,NO,都道府県名,市区町村名,データ名称,データ概要,データ形式,分類,更新頻度,URL,API対応有無,ライセンス,登録日,最終更新日,備考
132209,0000000001,東京都,東大和市,公共施設一覧,公共施設の一覧。,csv,行財政,1年に1回,,無,CC BYに準拠。,2020-03-18,2020-03-18,
132209,0000000002,東京都,東大和市,子育て施設一覧,幼稚園、保育園、認定こども園の一覧。,csv,教育・文化・スポーツ・生活,1年に1回,,無,CC BYに準拠。,2020-03-18,2020-03-18,
132209,0000000003,東京都,東大和市,介護サービス事業所一覧,介護サービス事業所の一覧。,csv,社会保障・衛生,1年に1回,,無,CC BYに準拠。,2020-03-18,2020-03-18,
132209,0000000004,東京都,東大和市,文化財一覧,国もしくは地方公共団体が指定、登録、選定等を行った文化財についての一覧。,csv,教育・文化・スポーツ・生活,1年に1回,,無,CC BYに準拠。,2020-03-18,2020-03-18,
132209,0000000005,東京都,東大和市,オープンデータ一覧,オープンデータ化されているデータセットの一覧,csv,その他,随時,,無,CC BYに準拠。,2020-03-18,2020-03-18,
